Stt,Tên chung cư,Địa chỉ,Đường,Phường/Xã,district_id,Quận/huyện,province_id,Thành phố/Tỉnh,Tọa độ,,
148,Ehome 3,"Đường Hồ Ngọc Lãm, phường An Lạc, quận Bình Tân, TPHCM",Đường Hồ Ngọc Lãm,phường An Lạc,419,Quận Bình Tân,34,HCM,"10.713219, 106.611736",,
149,Chung cư Lê Thành,"Mặt tiền đường Hồ Văn Long, phường Tân Tạo, quận Bình Tân, TP.HCM",Mặt tiền đường Hồ Văn Long,phường Tân Tạo,419,Quận Bình Tân,34,HCM,"10.763272, 106.578905",,
150,MD Home Building,Không tìm thấy địa chỉ cụ thể,,,419,Quận Bình Tân,34,HCM,,,
151,Tecco Town,"Số 4449 Nguyễn Cửu Phú, Tân Tạo A Quận Bình Tân, TP.HCM",Số 4449 Nguyễn Cửu Phú,Tân Tạo A Quận Bình Tân,419,Quận Bình Tân,34,HCM,"10.753965, 106.583732",,
152,Vision,"Đường Trần Đại Nghĩa, Phường Tân Tạo A, Bình Tân, TP.HCM",Đường Trần Đại Nghĩa,Phường Tân Tạo A,419,Quận Bình Tân,34,HCM,"10.727300, 106.596209",,
153,Chung Cư Thái Sơn,"Đường số 3A, Phường Tân Tạo A, Quận Bình Tân, TP.HCM",Đường số 3A,Phường Tân Tạo A,419,Quận Bình Tân,34,HCM,"10.753129, 106.592042",,
154,Moonlight Park View,"36-40 Đường số 7, An Lạc A, Bình Tân, TP.HCM",36-40 Đường số 7,An Lạc A,419,Quận Bình Tân,34,HCM,"10.751724, 106.620033",,
155,Angia Star,"Quốc Lộ 1 - Phường Tân Tạo - Quận Bình Tân, TP.HCM",Quốc Lộ 1,Phường Tân Tạo ,419,Quận Bình Tân,34,HCM,"10.762921, 106.591823",,
156,AIO City,"Số 1 Đường N3, An Lạc A, Bình Tân, TP.HCM",Số 1 Đường N3,An Lạc A,419,Quận Bình Tân,34,HCM,"10.742508, 106.612600",,
157,Hai Thành - Tên Lửa,"Đường Số 17A, Bình Trị Đông B, Bình Tân, TP.HCM",Đường Số 17A,Bình Trị Đông B,419,Quận Bình Tân,34,HCM,"10.741021, 106.604939",,
158,Full House,"Góc đường số 7 và đường 34, P. Bình Trị Đông B, Q. Bình Tân, TP.HCM",Góc đường số 7 và đường 34,P. Bình Trị Đông B,419,Quận Bình Tân,34,HCM,"10.752179, 106.607438",,
159,Lê Thành Twin Towers,"47 Đường số 2, Phường An Lạc, Quận Bình Tân, TP.HCM",47 Đường số 2,Phường An Lạc,419,Quận Bình Tân,34,HCM,"10.718314, 106.617434",,
160,The Alleys,"307 Lê Văn Quới, Bình Trị Đông A, Bình Tân, TP.HCM",307 Lê Văn Quới,Bình Trị Đông A,419,Quận Bình Tân,34,HCM,"10.776340, 106.607274",,
161,Saigonhomes,"819 Hương Lộ 2, Bình Trị Đông A, quận Bình Tân, TP.HCM",819 Hương Lộ 2,Bình Trị Đông A,419,Quận Bình Tân,34,HCM,"10.765305, 106.601585",,
162,Green Town Bình Tân,"130 Đường số 3, Bình Hưng Hoà B, Bình Tân, TP.HCM",130 Đường số 3,Bình Hưng Hoà B,419,Quận Bình Tân,34,HCM,"10.804812, 106.592459",,
163,8X Rainbow,"119 Bình Long, Bình Hưng Hoà A, Bình Tân, TP.HCM",119 Bình Long,Bình Hưng Hoà A,419,Quận Bình Tân,34,HCM,"10.779245, 106.620520",,
164,Nhất Lan 3,"Mặt tiền QL1A, Phường An Lạc, Quận Bình Tân (liền kề khu dân cư Tên Lửa)",Mặt tiền QL1A,Phường An Lạc,419,Quận Bình Tân,34,HCM,"10.752319, 106.592194",,
165,Tân Mai Apartment,"Quốc Lộ 1, Phường Tân Tạo, Quận Bình Tân, TP.HCM",Quốc Lộ 1,Phường Tân Tạo,419,Quận Bình Tân,34,HCM,"10.762763, 106.592060",,
166,Cavahome,Không tìm thấy địa chỉ cụ thể,,,421,Huyện Bình Chánh,34,HCM,,,
167,Him Lam 6A,"Đường số 14 khu dân cư Him Lam 6A – Trung Sơn, xã Bình Hưng, huyện Bình Chánh, TP.HCM",Đường số 14 khu dân cư Him Lam 6A – Trung Sơn,xã Bình Hưng,421,Huyện Bình Chánh,34,HCM,"10.732617, 106.687126",,
168,Saigon Mia,"Đường 9A KDC Trung Sơn, Bình Chánh TP. HCM",Đường 9A KDC Trung Sơn,,421,Huyện Bình Chánh,34,HCM,"10.733651, 106.689374",,
169,Citizen Trung Sơn,"Đường 9A KDC Trung Sơn, Bình Chánh",Đường 9A KDC Trung Sơn,,421,Huyện Bình Chánh,34,HCM,"10.731323, 106.688738",,
170,Ehome S Nam Saigon,"Khu đô thị Mizuki Park đại lộ Nguyễn Văn Linh, xã Bình Hưng, huyện Bình Chánh, TP.HCM",Khu đô thị Mizuki Park đại lộ Nguyễn Văn Linh,xã Bình Hưng,421,Huyện Bình Chánh,34,HCM,"10.715459, 106.662194",,
171,Flora Mizuki (Mizuki Park),"Khu đô thị Mizuki Park đại lộ Nguyễn Văn Linh, xã Bình Hưng, huyện Bình Chánh, TP.HCM",Khu đô thị Mizuki Park đại lộ Nguyễn Văn Linh,xã Bình Hưng,421,Huyện Bình Chánh,34,HCM,"10.713895, 106.661971",,
172,Terra Mia,"mặt tiền đường số 2 KDC 6B Kiên Cường, Bình Hưng, Bình Chánh, TP.HCM",mặt tiền đường số 2 KDC 6B Kiên Cường,Bình Hưng,421,Huyện Bình Chánh,34,HCM,"10.723059, 106.688303",,
173,Chung cư 6B The Easter City,"Lô số 4 đường Chánh Hưng, xã Bình Hưng, huyện Bình Chánh, TP.HCM",Lô số 4 đường Chánh Hưng,xã Bình Hưng,421,Huyện Bình Chánh,34,HCM,"10.722252, 106.683373",,
174,Thảo Loan Plaza,"Đường 9A KDC Trung Sơn, Bình Chánh",Đường 9A KDC Trung Sơn,,421,Huyện Bình Chánh,34,HCM,"10.731323, 106.688738",,
175,Chung Cư Happy City,"Lô 11B, xã Bình Hưng, huyện Bình Chánh, TP.HCM",Lô 11B,xã Bình Hưng,421,Huyện Bình Chánh,34,HCM,"10.713514, 106.650487",,
176,Southern Park,"Phạm Hùng, Xã Bình Hưng, H. Bình Chánh, TP.HCM",Phạm Hùng,Xã Bình Hưng,421,Huyện Bình Chánh,34,HCM,"10.722180, 106.683367",,
177,Charmington Golf & Life,"18B Nguyễn Văn Linh, Xã Bình Hưng, Huyện Bình Chánh, TP.HCM",18B Nguyễn Văn Linh,Xã Bình Hưng,421,Huyện Bình Chánh,34,HCM,"10.721260, 106.658502",,
178,Westgate Park,"349 đường Tân Túc, thị trấn Tân Túc, huyện Bình Chánh, TP.HCM",349 đường Tân Túc,thị trấn Tân Túc,421,Huyện Bình Chánh,34,HCM,"10.688468, 106.585398",,
179,Victoria Garden,"Số 10 đường Trần Đại Nghĩa, Xã Tân Kiên, Huyện Bình Chánh, TP. HCM",Số 10 đường Trần Đại Nghĩa,Xã Tân Kiên,421,Huyện Bình Chánh,34,HCM,"10.726118, 106.592315",,
180,Rubi Homes,Không tìm được địa chỉ,,,421,Huyện Bình Chánh,34,HCM,,,
181,Lovera Vista,"Mặt tiền đường số 19, thuộc khu dân cư Phong Phú 4, huyện Bình Chánh, TP.HCM",Mặt tiền đường số 19,thuộc khu dân cư Phong Phú 4,421,Huyện Bình Chánh,34,HCM,"10.691800, 106.642906",,
182,Dynamic Tower,"Đường Nguyễn Văn Linh, Xã Phong Phú, Bình Chánh, TP.HCM",Đường Nguyễn Văn Linh,Xã Phong Phú,421,Huyện Bình Chánh,34,HCM,"10.707863, 106.640308",,
183,Calla Garden,"Đường Nguyễn Văn Linh, Xã Phong Phú, Bình Chánh, TP.HCM",Đường Nguyễn Văn Linh,Xã Phong Phú,421,Huyện Bình Chánh,34,HCM,"10.712165, 106.645474",,
184,Saigon Intela,"Đường số 5, xã Phong Phú, huyện Bình Chánh, TP.HCM",Đường số 5,xã Phong Phú,421,Huyện Bình Chánh,34,HCM,"10.703090, 106.647955",,
185,A.View,"Đường Nguyễn Văn Linh, Xã Phong Phú, Bình Chánh, TP.HCM",Đường Nguyễn Văn Linh,Xã Phong Phú,421,Huyện Bình Chánh,34,HCM,"10.712743, 106.646191",,
186,Chung cư Conic Đông Nam Á,"KDC Conic, đường Nguyễn Văn Linh, xã Phong Phú, huyện Bình Chánh, TP.HCM",KDC Conic,đường Nguyễn Văn Linh,421,Huyện Bình Chánh,34,HCM,"10.710218, 106.642803",,
187,Conic Garden,"KDC Conic, đường Nguyễn Văn Linh, xã Phong Phú, huyện Bình Chánh, TP.HCM",KDC Conic,đường Nguyễn Văn Linh,421,Huyện Bình Chánh,34,HCM,"10.717423, 106.638169",,
188,Conic Skyway Residence,"KDC Conic, đường Nguyễn Văn Linh, xã Phong Phú, huyện Bình Chánh, TP.HCM",KDC Conic,đường Nguyễn Văn Linh,421,Huyện Bình Chánh,34,HCM,"10.710218, 106.642803",,
189,Conic Đình Khiêm,"Đường Nguyễn Văn Linh, Xã Phong Phú, Bình Chánh, TP.HCM",Đường Nguyễn Văn Linh,Xã Phong Phú,421,Huyện Bình Chánh,34,HCM,"10.710208, 106.642187",,
190,Terra Rosa,"Nguyễn Văn Linh - khu dân cư Intresco 13E- xã Phong Phú- Bình Chánh, TP.HCM",Nguyễn Văn Linh - khu dân cư Intresco 13E,Xã phong Phu1,421,Huyện Bình Chánh,34,HCM,"10.705991, 106.644211",,
191,Chung cư HQC Plaza,"Đường Nguyễn Văn Linh, Xã An Phú Tây, Huyện Bình Chánh, TP.HCM",Đường Nguyễn Văn Linh,Xã An Phú Tây,421,Huyện Bình Chánh,34,HCM,"10.693768, 106.606751",,
192,City Gate 5,"Đường Hưng Nhơn, xã Tân Kiên, huyện Bình Chánh, TP.HCM",Đường Hưng Nhơn,xã Tân Kiên,421,Huyện Bình Chánh,34,HCM,"10.715169, 106.588341",,
193,Chung cư Lê Thành Tân Kiên,Không tìm được địa chỉ,,,421,Huyện Bình Chánh,34,HCM,,,
194,Sunrise Riverside,"khu biệt thự Trần Thái, xã Phước Kiển, huyện Nhà Bè – TP. HCM",khu biệt thự Trần Thái,xã Phước Kiển,422,Huyện Nhà Bè,34,HCM,"10.721756, 106.703578",,
195,Saigon South Residences,"113A Đ.Nguyễn Hữu Thọ, Phước Kiển, Nhà Bè, TP.HCM",113A Đ.Nguyễn Hữu Thọ,Phước Kiển,422,Huyện Nhà Bè,34,HCM,"10.720375, 106.703074",,
196,Dragon Hill 1,"Số 15A1 Khu đô thị Dragon City Nguyễn Hữu Thọ, huyện Nhà Bè, TP.HCM",Số 15A1 Khu đô thị Dragon City Nguyễn Hữu Thọ,huyện Nhà Bè,422,Huyện Nhà Bè,34,HCM,"10.710159, 106.708799",,
197,Dragon Hill Residence and Suite,"Số 15A1 Khu đô thị Dragon City Nguyễn Hữu Thọ, huyện Nhà Bè, TP.HCM",Số 15A1 Khu đô thị Dragon City Nguyễn Hữu Thọ,huyện Nhà Bè,422,Huyện Nhà Bè,34,HCM,"10.710159, 106.708799",,
198,The Park Residence (Phú Hoàng Anh),"Đường Nguyễn Hữu Thọ, Phước Kiển, Nhà Bè, TP.HCM",Đường Nguyễn Hữu Thọ,Phước Kiển,422,Huyện Nhà Bè,34,HCM,"10.712059, 106.707231",,
199,Hoàng Anh Gold House (Hoàng Anh An Tiến),"187A Lê Văn Lương, Phước Kiển, Nhà Bè, TP.HCM",187A Lê Văn Lương,Phước Kiển,422,Huyện Nhà Bè,34,HCM,"10.710398, 106.703451",,
200,New Saigon - Hoàng Anh Gia Lai 3,"Đường Nguyễn Hữu Thọ, Xã Phước Kiển, Huyện Nhà Bè, TP.HCM",Đường Nguyễn Hữu Thọ,Xã Phước Kiển,422,Huyện Nhà Bè,34,HCM,"10.720555, 106.700373",,
201,Hưng Phát 1,"44 Lê Văn Lương, Phước Kiển, Nhà Bè, TP.HCM",44 Lê Văn Lương,Phước Kiển,422,Huyện Nhà Bè,34,HCM,"10.713930, 106.700875",,
202,Hưng Phát Silver Star,"156A đường Nguyễn Hữu Thọ, Phước Kiển, Nhà Bè, TP.HCM",156A đường Nguyễn Hữu Thọ,Phước Kiển,422,Huyện Nhà Bè,34,HCM,"10.716881, 106.702130",,
203,Park Vista,"Đường Nguyễn Hữu Thọ, Phước Kiển, Nhà Bè, TP.HCM",Đường Nguyễn Hữu Thọ,Phước Kiển,422,Huyện Nhà Bè,34,HCM,"10.712811, 106.706132",,
204,Goldora Plaza,"26 Lê Văn Lương, Phước Kiển, Nhà Bè, TP.HCM",26 Lê Văn Lương,Phước Kiển,422,Huyện Nhà Bè,34,HCM,"10.719345, 106.699097",,
205,Kenton Residences,"Số 116A Đường Nguyễn Hữu Thọ, P. Phước Kiển, Nhà Bè, TP.HCM",Số 116A Đường Nguyễn Hữu Thọ,P. Phước Kiển,422,Huyện Nhà Bè,34,HCM,"10.720989, 106.701101",,
206,Celesta Rise,"Đường Nguyễn Hữu Thọ, xã Phước Kiển, huyện Nhà Bè, TP. HCM",Đường Nguyễn Hữu Thọ,xã Phước Kiển,422,Huyện Nhà Bè,34,HCM,"10.709450, 106.708612",,
207,La Partenza,"Đường Lê Văn Lương, Phước Kiển, Nhà Bè, TP.HCM",Đường Lê Văn Lương,Phước Kiển,422,Huyện Nhà Bè,34,HCM,"10.684373, 106.701120",,
208,ZeitGeist Nhà Bè,"Đường Nguyễn Hữu Thọ, Phước Kiển, Nhà Bè, TP.HCM",Đường Nguyễn Hữu Thọ,Phước Kiển,422,Huyện Nhà Bè,34,HCM,"10.698947, 106.716358",,
209,Orchid Park,"Mặt tiền 15B – Nguyễn Lương Bằng – Phú Xuân – Nhà Bè, TP.HCM",Mặt tiền 15B Nguyễn Lương Bằng,Phú Xuân,422,Huyện Nhà Bè,34,HCM,"10.678900, 106.740399",,
210,Phú Mỹ Thuận,"Đường Huỳnh Tấn Phát -  Xã Phú Xuân – H. Nhà Bè, TP.HCM",Đường Huỳnh Tấn Phát ,Xã Phú Xuân,422,Huyện Nhà Bè,34,HCM,"10.679347, 106.749951",,
211,Chung Cư STCITY,"245 Bùi Văn Ngữ, P. Tân Chánh Hiệp, Huyện Hóc Môn, TP.HCM",245 Bùi Văn Ngữ,P. Tân Chánh Hiệp,415,Huyện Hóc Môn,34,HCM,"10.871592, 106.618655",,
212,Cheery 3 Apartment,"Đường Nguyễn Thị Sóc, phường Xuân Thới Đông, huyện Hóc Môn, TP.HCM",Đường Nguyễn Thị Sóc,phường Xuân Thới Đông,415,Huyện Hóc Môn,34,HCM,"10.861055, 106.601860",,
213,HQC Hóc Môn,"Đường Nguyễn Thị Sóc, phường Xuân Thới Đông, huyện Hóc Môn, TP.HCM",Đường Nguyễn Thị Sóc,phường Xuân Thới Đông,415,Huyện Hóc Môn,34,HCM,"10.861055, 106.601860",,
214,Thảo Điền Pearl,"12 Quốc Hương, phường Thảo Điền, Quận 2",12 Quốc Hương,phường Thảo Điền,411,TP Thủ Đức,34,HCM,"10.801106, 106.732779",,
215,Mozac Thảo Điền,"12 Quốc Hương, phường Thảo Điền, Quận 2",12 Quốc Hương,phường Thảo Điền,411,TP Thủ Đức,34,HCM,"10.801106, 106.732779",,
216,Hoàng Anh River view,"37 Nguyễn Văn Hưởng, Phường Thảo Điền, Quận 2",37 Nguyễn Văn Hưởng,Phường Thảo Điền,411,TP Thủ Đức,34,HCM,"10.804382, 106.726745",,
217,Tropic Garden,"49 Đường 66 giáp trục Nguyễn Văn Hưởng, P. Thảo Điền, Q.2, TP.HCM",49 Đường 66 giáp trục Nguyễn Văn Hưởng,P. Thảo Điền,411,TP Thủ Đức,34,HCM,"10.813215, 106.728586",,
218,Thủ Thiêm Sky,"Hẻm 204 Đường Nguyễn Văn Hưởng, Phường Thảo Điền, Quận 2",Hẻm 204 Đường Nguyễn Văn Hưởng,Phường Thảo Điền,411,TP Thủ Đức,34,HCM,"10.815021, 106.730343",,
219,River Garden,"170 Nguyễn Văn Hưởng, P Thảo Điền, Quận 2",170 Nguyễn Văn Hưởng,P Thảo Điền,411,TP Thủ Đức,34,HCM,"10.815363, 106.727192",,
220,Xi Riverview,"190 Nguyễn Văn Hưởng, phường Thảo Điền, Quận 2",190 Nguyễn Văn Hưởng,phường Thảo Điền,411,TP Thủ Đức,34,HCM,"10.817233, 106.730494",,
221,D’Edge,"Đường Nguyễn Văn Hưởng, Phường Thảo Điền, Quận 2",Đường Nguyễn Văn Hưởng,Phường Thảo Điền,411,TP Thủ Đức,34,HCM,"10.813074, 106.732607",,
222,The Ascent,"58 Quốc Hương, Phường Thảo Điền, Quận 2, TP.HCM",58 Quốc Hương,Phường Thảo Điền,411,TP Thủ Đức,34,HCM,"10.807187, 106.731216",,
223,Masteri Thảo Điền,"159 Xa lộ Hà Nội, Quận 2, TP. HCM",159 Xa lộ Hà Nội,Quận 2,411,TP Thủ Đức,34,HCM,"10.802304, 106.742552",,
224,The Nassim,"30 Đường số 11, Thảo Điền, Quận 2",30 Đường số 11,Thảo Điền,411,TP Thủ Đức,34,HCM,"10.804597, 106.743999",,
225,Gateway Thảo Điền,"2 Lê Thước, phường Thảo Điền, Quận 2, TP.HCM",2 Lê Thước,phường Thảo Điền,411,TP Thủ Đức,34,HCM,"10.803329, 106.745744",,
226,Q2 Thảo Điền,"Mặt tiền đường Võ Trường Toản và Đường số 9 & 10, phường Thảo Điền, Quận 2",Mặt tiền đường Võ Trường Toản và Đường số 9 & 10,phường Thảo Điền,411,TP Thủ Đức,34,HCM,"10.804660, 106.747417",,
227,Thảo Điền Green,"192 Nguyễn Văn Hưởng, Phường Thảo Điền, Quận 2, TP HCM",192 Nguyễn Văn Hưởng,Phường Thảo Điền,411,TP Thủ Đức,34,HCM,"10.817393, 106.731235",,
228,The Sun Avenue,"Mặt tiền Mai Chí Thọ, P. An Phú, Quận 2, TP. HCM",Mặt tiền Mai Chí Thọ,P. An Phú,411,TP Thủ Đức,34,HCM,"10.785507, 106.748070",,
229,Rome Diamond Lotus,"Số 50 Đường Mai Chí Thọ, Phường An Phú, Quận 2",Số 50 Đường Mai Chí Thọ,Phường An Phú,411,TP Thủ Đức,34,HCM,"10.786441, 106.751042",,
230,Centana Thủ Thiêm,"Mặt tiền Mai Chí Thọ, Phường An Phú, Quận 2, Tp HCM",Mặt tiền Mai Chí Thọ,Phường An Phú,411,TP Thủ Đức,34,HCM,"10.791335, 106.752369",,
231,D’Lusso,"Hẻm đường Nguyễn Thị Định, phường An Phú, Quận 2, TP.HCM",Hẻm đường Nguyễn Thị Định,phường An Phú,411,TP Thủ Đức,34,HCM,"10.791625, 106.754944",,
232,Precia,"Hẻm đường Nguyễn Thị Định, phường An Phú, Quận 2, TP.HCM",Hẻm đường Nguyễn Thị Định,phường An Phú,411,TP Thủ Đức,34,HCM,"10.791155, 106.754182",,
233,Palm Heights - Palm City,"Khu đô thị Palm City, Song hành cao tốc TP.HCM – Long Thành – Dầu Giây, phường An Phú, Quận 2",Khu đô thị Palm City,Song hành cao tốc TP.HCM – Long Thành – Dầu Giây,411,TP Thủ Đức,34,HCM,"10.791986, 106.760930",,
234,Palm Garden - Palm City,"Khu đô thị Palm City, Song hành cao tốc TP.HCM – Long Thành – Dầu Giây, phường An Phú, Quận 2",Khu đô thị Palm City,Song hành cao tốc TP.HCM – Long Thành – Dầu Giây,411,TP Thủ Đức,34,HCM,"10.791640, 106.762019",,
235,Palm Spring - Palm City,Không tìm thấy địa chỉ cụ thể,,,411,TP Thủ Đức,34,HCM,,,
236,Gem Riverside,"Khu đô thị Nam Rạch Chiếc, Phường An Phú, Quận 2, TP. Hồ Chí Minh",Khu đô thị Nam Rạch Chiếc,Phường An Phú,411,TP Thủ Đức,34,HCM,"10.793173, 106.766481",,
237,Velona Saigon  Sports City,"Khu đô thị Saigon Sports City, phường An Phú, Quận 2, TP.HCM",Khu đô thị Saigon Sports City,phường An Phú,411,TP Thủ Đức,34,HCM,"10.799659, 106.767018",,
238,The Vista An Phú,"Số 628C Xa lộ Hà Nội, Phường An Phú, Quận 2, Tp.HCM",Số 628C Xa lộ Hà Nội,Phường An Phú,411,TP Thủ Đức,34,HCM,"10.804829, 106.751790",,
239,Masteri Lumiere Riverside,"259 Xa lộ Hà Nội, Phường An Phú, Quận 2, TP.HCM",259 Xa lộ Hà Nội,Phường An Phú,411,TP Thủ Đức,34,HCM,"10.803464, 106.747947",,
240,Laimian City,"Mặt tiền đường Lương Định Của, Trần Lựu, Quận 2",Mặt tiền đường Lương Định Của,Trần Lựu,411,TP Thủ Đức,34,HCM,"10.792718, 106.738139",,
241,Screc II Tower,"Mặt tiền đường số 2 và 37A thuộc KDC An Phú, Quận 2",Mặt tiền đường số 2 và 37A thuộc KDC An Phú,,411,TP Thủ Đức,34,HCM,"10.791267, 106.740595",,
242,"Era Bình Khánh (N,J,CD)","Đường số 9-BK, phường Bình Khánh, Quận 2",Đường số 9-BK,phường Bình Khánh,411,TP Thủ Đức,34,HCM,"10.786531, 106.740746",,
243,Cantavil & Cantavil Premier,"8 Đường Xa Lộ Hà Nội, Phường An Phú, Quận 2",8 Đường Xa Lộ Hà Nội,Phường An Phú,411,TP Thủ Đức,34,HCM,"10.801826, 106.746832",,
244,Imperia An Phú,"Ngay giao lộ Mai Chí Thọ và Xa lộ Hà Nội, An Phú, Quận 2",Ngay giao lộ Mai Chí Thọ và Xa lộ Hà Nội,An Phú,411,TP Thủ Đức,34,HCM,"10.799179, 106.750272",,
245,Estella Heights,"Khu phố 3 Xa Lộ Hà Nội, P. An Phú, Quận 2",Khu phố 3 Xa Lộ Hà Nội,P. An Phú,411,TP Thủ Đức,34,HCM,"10.802075, 106.748694",,
246,The Estella,"Khu phố 3 Xa Lộ Hà Nội, P. An Phú, Quận 2",Khu phố 3 Xa Lộ Hà Nội,P. An Phú,411,TP Thủ Đức,34,HCM,"10.800693, 106.748230",,
247,The Palace Residence,"Mặt tiền Đường Song Hành – Xa lộ Hà Nội và đường Mai Chí Thọ, Quận 2",Mặt tiền Đường Song Hành – Xa lộ Hà Nội và đường Mai Chí Thọ,,411,TP Thủ Đức,34,HCM,"10.800126, 106.750598",,
248,Lexington Residence,"67 Mai Chí Thọ, An Phú, Quận 2",67 Mai Chí Thọ,An Phú,411,TP Thủ Đức,34,HCM,"10.799298, 106.751641",,
249,An Lộc - An Phúc,"Vũ Tông Phan + Nguyễn Hoàng, Phường An Phú, Quận 2, TPHCM",Vũ Tông Phan + Nguyễn Hoàng,Phường An Phú,411,TP Thủ Đức,34,HCM,"10.798902, 106.744500",,
250,PetroVietnam Landmark,"Đường Mai Chí Thọ, Phường An Phú, Quận 2",Đường Mai Chí Thọ,Phường An Phú,411,TP Thủ Đức,34,HCM,"10.797301, 106.750507",,
251,Bình An Pearl,"2 Trần Não, Phường Bình An, Quận 2",2 Trần Não,Phường Bình An,411,TP Thủ Đức,34,HCM,"10.795680, 106.731040",,
252,Chung cư Bộ Công An,"Số 83 Đường số 3, Phường Bình An, Quận 2, TP.HCM",Số 83 Đường số 3,Phường Bình An,411,TP Thủ Đức,34,HCM,"10.794862, 106.736519",,
253,Sunshine Venicia,"Mặt tiền đường số 34 và 39, phường Bình An, Quận 2",Mặt tiền đường số 34 và 39,phường Bình An,411,TP Thủ Đức,34,HCM,"10.787805, 106.726988",,
254,Paris Hoàng Kim,"Số 25 đường Lương Định Của, Phường Bình Khánh, Quận 2, TP. HCM",Số 25 đường Lương Định Của,Phường Bình Khánh,411,TP Thủ Đức,34,HCM,"10.784441, 106.728230",,
255,De Capella,"116 Lương Định Của, phường Bình Khánh, Quận 2",116 Lương Định Của,phường Bình Khánh,411,TP Thủ Đức,34,HCM,"10.787533, 106.735300",,
256,Tái định cư Bình Khánh,"Đường số 10 khu tái định cư An Phú - Bình Khánh, Quận 2",Đường số 10 khu tái định cư An Phú - Bình Khánh,,411,TP Thủ Đức,34,HCM,"10.783529, 106.736298",,
257,New City Thủ Thiêm,"Số 17 Mặt tiền đường Mai Chí Thọ, Phường Bình Khánh,Khu Đô Thị Thủ Thiêm, Quận 2",Số 17 Mặt tiền đường Mai Chí Thọ,Phường Bình Khánh,411,TP Thủ Đức,34,HCM,"10.780516, 106.736051",,
258,The Water Bay,"Số 26 Mai Chí Thọ, Phường Bình Khánh, Quận 2",Số 26 Mai Chí Thọ,Phường Bình Khánh,411,TP Thủ Đức,34,HCM,"10.775069, 106.726898",,
259,Sài Gòn Broadway,"Mặt tiền đường Mai Chí Thọ, Phường Bình Khánh, Quận 2",Mặt tiền đường Mai Chí Thọ,Phường Bình Khánh,411,TP Thủ Đức,34,HCM,"10.782885, 106.740448",,
260,The River Thủ Thiêm,"Ngay chân cầu Thủ Thiêm 1 về phía khu đô thị Thủ Thiêm Quận 2 (Lô 3.15 + 3.16 Đại Lộ Vòng Cung, khu đô thị Thủ Thiêm), Quận 2, TP. HCM",Ngay chân cầu Thủ Thiêm 1 về phía khu đô thị Thủ Thiêm Quận 2 (Lô 3.15 + 3.16 Đại Lộ Vòng Cung,khu đô thị Thủ Thiêm),411,TP Thủ Đức,34,HCM,"10.780401, 106.717222",,
262,The Metropole Thủ Thiêm,"Lô 1.16 và Lô 1.17 trong Khu đô thị mới Thủ Thiêm, Quận 2.",Lô 1.16 và Lô 1.17 trong Khu đô thị mới Thủ Thiêm,,411,TP Thủ Đức,34,HCM,"10.775956, 106.713247",,
263,Empire City,"Thuộc khu chức năng số 2 (khu 2B) khu đô thị mới Thủ Thiêm, Quận 2",Thuộc khu chức năng số 2 (khu 2B) khu đô thị mới Thủ Thiêm,,411,TP Thủ Đức,34,HCM,"10.769671, 106.711860",,
264,Eco Smart City,"Khu chức năng số 2A - Khu đô thị Thủ Thiêm, Quận 2, TP. HCM",Khu chức năng số 2A - Khu đô thị Thủ Thiêm,Quận 2,411,TP Thủ Đức,34,HCM,"10.772861, 106.714859",,
265,Sala Sadora - KĐT Sala,"Khu đô thị Sala, đô thị mới Thủ Thiêm, Quận 2",Khu đô thị Sala,đô thị mới Thủ Thiêm,411,TP Thủ Đức,34,HCM,"10.772336, 106.723776",,
266,Sala Sarimi - KĐT Sala,"Khu đô thị Sala, đô thị mới Thủ Thiêm, Quận 2",Khu đô thị Sala,đô thị mới Thủ Thiêm,411,TP Thủ Đức,34,HCM,"10.772336, 106.723776",,
267,Sala Sarica - KĐT Sala,"Khu đô thị Sala, đô thị mới Thủ Thiêm, Quận 2",Khu đô thị Sala,đô thị mới Thủ Thiêm,411,TP Thủ Đức,34,HCM,"10.772336, 106.723776",,
268,Sala Sarina - KĐT Sala,"Khu đô thị Sala, đô thị mới Thủ Thiêm, Quận 2",Khu đô thị Sala,đô thị mới Thủ Thiêm,411,TP Thủ Đức,34,HCM,"10.772336, 106.723776",,
269,Diamond Island,"Số 1 Đường 104-BTT, P. Bình Trưng Tây, Quận 2, TP. Hồ Chí Minh hay còn gọi (Đảo Kim Cương Quận 2, ngay  trung tâm hành chính quận 2)",Số 1 Đường 104-BTT,P. Bình Trưng Tây,411,TP Thủ Đức,34,HCM,"10.777495, 106.747105",,
270,Homyland 1,"202 Nguyễn Duy Trinh, Phường Bình Trưng Tây, Quận 2",202 Nguyễn Duy Trinh,Phường Bình Trưng Tây,411,TP Thủ Đức,34,HCM,"10.786408, 106.762731",,
271,Homyland 2,"307 Nguyễn Duy Trinh, phường Bình Trưng Tây, Quận 2",307 Nguyễn Duy Trinh,phường Bình Trưng Tây,411,TP Thủ Đức,34,HCM,"10.788261, 106.765652",,
272,Homyland 3,"Hẻm 401 Nguyễn Duy Trinh, phường Bình Trưng Tây, Quận 2",Hẻm 401 Nguyễn Duy Trinh,phường Bình Trưng Tây,411,TP Thủ Đức,34,HCM,"10.789657, 106.769227",,
273,La Astoria,"383 Nguyễn Duy Trinh, P. Bình Trưng Tây, Quận 2",383 Nguyễn Duy Trinh,P. Bình Trưng Tây,411,TP Thủ Đức,34,HCM,"10.788315, 106.767915",,
274,PARCSpring,"537 Nguyễn Duy Trinh, phường Bình Trưng Đông, Quận 2",537 Nguyễn Duy Trinh,phường Bình Trưng Đông,411,TP Thủ Đức,34,HCM,"10.790424, 106.771773",,
275,The Krista,"Hẻm 537 Nguyễn Duy Trinh, phường Bình Trưng Đông, Quận 2",Hẻm 537 Nguyễn Duy Trinh,phường Bình Trưng Đông,411,TP Thủ Đức,34,HCM,"10.789837, 106.770737",,
276,Kris Vue,"Hẻm 537 Nguyễn Duy Trinh - Hồ Thị Nhung, phường Bình Trưng Đông, Quận 2",Hẻm 537 Nguyễn Duy Trinh - Hồ Thị Nhung,phường Bình Trưng Đông,411,TP Thủ Đức,34,HCM,"10.789646, 106.771771",,
277,Thủ Thiêm Xanh,"Số 1 Đường 63, Phường Bình Trưng Đông, Quận 2",Số 1 Đường 63,Phường Bình Trưng Đông,411,TP Thủ Đức,34,HCM,"10.789817, 106.776875",,
278,Chung cư Petroland,"Số 2 Đường 62, Bình Trưng Đông, Quận 2",Số 2 Đường 62,Bình Trưng Đông,411,TP Thủ Đức,34,HCM,"10.791579, 106.776526",,
279,Thủ Thiêm Star,"Đường 54, Bình Trưng Đông, Quận 2",Đường 54,Bình Trưng Đông,411,TP Thủ Đức,34,HCM,"10.792298, 106.777613",,
